{
  "schema_version": "1.3.0",
  "job_id": "pilot-001-panel-page-001-p4-v001",
  "job_type": "manga_panel",
  "output_filename": ".manga-studio/handoff/generated/panels/page-001-panel-04-v001.png",
  "output_spec": {"format": "png", "width": 1400, "height": 2200, "color_mode": "grayscale", "alpha_allowed": false},
  "content_constraints": {"age_band": "teen and older", "content_rating": "teen", "content_boundaries": ["No graphic injury", "No sexual content", "Threat remains suspenseful rather than sadistic"], "sensitivity_requirements": ["Fear responses should not be mocked", "Avoid glamorizing reckless isolation"], "accessibility_goals": ["Clear event order", "Readable concise dialogue", "Every SFX includes reader-facing meaning"]},
  "required_reference_images": [],
  "reference_priority": [
    "rain-platform-reference-v001",
    "protagonist-mira-reference-v001",
    "brass-ticket-punch-reference-v001",
    "supporting-ren-reference-v001"
  ],
  "scene_state": {
    "page_id": "page-001",
    "panel_id": "p4",
    "time": "night",
    "weather": "rain beyond the platform roof",
    "beat": "Mira points the ticket punch toward the dark tunnel as if answering the bell."
  },
  "character_state": {
    "mira": "Seen from low track-level angle, right arm extended with ticket punch.",
    "ren": "Behind Mira, watchful and tense."
  },
  "composition": {
    "camera": "low track-level vertical shot",
    "framing": "ticket punch points toward a dark tunnel opening; Mira in foreground, Ren behind",
    "reading_focus": "ticket punch, Mira, dark tunnel",
    "event_direction": {
      "event_type": "action",
      "intensity": 5,
      "importance": 5,
      "shot_size": "full",
      "camera_angle": "worms_eye",
      "camera_motion": "tracking",
      "action_direction": "right_to_left",
      "emotional_beat": "the pair choose to confront the unseen arrival",
      "pose_and_expression": "Mira leads with a decisive arm line; Ren braces behind her and watches the tunnel",
      "show_dont_tell_cue": "Mira's forward line and Ren's planted stance show their choice to face the unseen train."
    },
    "background_priority": "story_critical"
  },
  "safe_zone_coordinate_system": "source_normalized",
  "dialogue_safe_zones": [
    {
      "x": 0.1,
      "y": 0.11,
      "width": 0.68,
      "height": 0.19
    }
  ],
  "manga_style": {
    "palette": "black-and-white",
    "linework": "dramatic ink perspective with deep blacks",
    "line_weight_strategy": "Heavy rail and tunnel silhouettes, medium character contours, and fine rain texture.",
    "solid_black_strategy": "Make the tunnel a dominant black mass while preserving readable figure silhouettes.",
    "screen_tones": "rain, tunnel shadow, wet track highlights",
    "contrast_plan": "Pale wet rails and faces cut through the tunnel's solid-black threat.",
    "depth_plan": "Foreshortened punch, figures, rails, and tunnel create four readable depth layers.",
    "motion_language": "Rail diagonals and Mira's arm drive the eye right-to-left into the tunnel.",
    "genre": "quiet supernatural mystery manga"
  },
  "quality_profile": {
    "tier": "high",
    "goals": [
      "event clarity at thumbnail size",
      "expressive character acting",
      "dynamic event-driven composition",
      "strict reference continuity",
      "professional black-and-white manga finish"
    ],
    "variation_policy": "event_driven",
    "continuity_strictness": "locked",
    "detail_budget": "high",
    "self_check_required": true
  },
  "required_elements": [
    "Mira's right arm extended",
    "ticket punch pointed toward the tunnel",
    "Ren visible behind Mira",
    "dark tunnel at track end",
    "rain and wet rail highlights"
  ],
  "prohibited_elements": [
    "dialogue_text",
    "captions",
    "speech_balloons",
    "sound_effect_text",
    "panel_borders",
    "page_numbers",
    "signatures",
    "watermarks",
    "color"
  ],
  "revision_history": [
    {
      "version": "v001",
      "output_filename": ".manga-studio/handoff/generated/panels/page-001-panel-04-v001.png",
      "supersedes_job_id": null,
      "supersedes_output_filename": null,
      "notes": "Initial page 001 panel 4 job."
    }
  ],
  "release_status": "deferred",
  "blocking_reasons": [
    "IMAGE_READY is false.",
    "Image generation is disabled for the pilot fixture."
  ],
  "deferred_reference_dependencies": [
    {
      "reference_id": "protagonist-mira-reference-v001",
      "source_job_id": "pilot-001-ref-protagonist-v001",
      "kind": "character_reference",
      "usage": "Use for Mira's silhouette, hair clip, rain jacket, and right hand."
    },
    {
      "reference_id": "supporting-ren-reference-v001",
      "source_job_id": "pilot-001-ref-supporting-character-v001",
      "kind": "character_reference",
      "usage": "Use for Ren's background silhouette, glasses, and coat."
    },
    {
      "reference_id": "brass-ticket-punch-reference-v001",
      "source_job_id": "pilot-001-ref-prop-v001",
      "kind": "prop_reference",
      "usage": "Use for the ticket punch shape as Mira points it toward the track."
    },
    {
      "reference_id": "rain-platform-reference-v001",
      "source_job_id": "pilot-001-ref-location-v001",
      "kind": "location_reference",
      "usage": "Use for track-level geometry and dark tunnel placement."
    }
  ]
}
