{
  "schema_version": "1.3.0",
  "job_id": "pilot-001-panel-page-001-p3-v001",
  "job_type": "manga_panel",
  "output_filename": ".manga-studio/handoff/generated/panels/page-001-panel-03-v001.png",
  "output_spec": {"format": "png", "width": 1400, "height": 2200, "color_mode": "grayscale", "alpha_allowed": false},
  "content_constraints": {"age_band": "teen and older", "content_rating": "teen", "content_boundaries": ["No graphic injury", "No sexual content", "Threat remains suspenseful rather than sadistic"], "sensitivity_requirements": ["Fear responses should not be mocked", "Avoid glamorizing reckless isolation"], "accessibility_goals": ["Clear event order", "Readable concise dialogue", "Every SFX includes reader-facing meaning"]},
  "required_reference_images": [],
  "reference_priority": [
    "protagonist-mira-reference-v001",
    "brass-ticket-punch-reference-v001",
    "rain-platform-reference-v001"
  ],
  "scene_state": {
    "page_id": "page-001",
    "panel_id": "p3",
    "time": "night",
    "weather": "rain reflected behind the character",
    "beat": "Mira lifts the brass ticket punch into the frame."
  },
  "character_state": {
    "mira": "Close shot, focused expression, right hand lifting the closed ticket punch."
  },
  "composition": {
    "camera": "close vertical shot",
    "framing": "Mira's face in upper third, ticket punch prominent in foreground",
    "reading_focus": "Mira's eyes, then ticket punch",
    "event_direction": {
      "event_type": "reaction",
      "intensity": 4,
      "importance": 4,
      "shot_size": "detail",
      "camera_angle": "eye_level",
      "camera_motion": "push_in",
      "action_direction": "toward_camera",
      "emotional_beat": "fear settles into prepared resolve",
      "pose_and_expression": "Mira's grip is controlled and her eyes sharpen without exaggerated shouting",
      "show_dont_tell_cue": "Her steady grip and narrowed gaze communicate resolve without a declaration."
    },
    "background_priority": "minimal"
  },
  "safe_zone_coordinate_system": "source_normalized",
  "dialogue_safe_zones": [
    {
      "x": 0.11,
      "y": 0.05,
      "width": 0.76,
      "height": 0.18
    }
  ],
  "manga_style": {
    "palette": "black-and-white",
    "linework": "expressive close-up ink linework",
    "line_weight_strategy": "Heavy prop silhouette, controlled facial contours, and fine rain reflections.",
    "solid_black_strategy": "Concentrate solid black behind the eyes and around the hand to isolate the decision beat.",
    "screen_tones": "soft rain reflections, strong prop highlights",
    "contrast_plan": "Bright metal edges and eye whites stand against compressed dark midtones.",
    "depth_plan": "The ticket punch projects toward the reader while Mira's face remains clearly behind it.",
    "motion_language": "A restrained push-in is suggested by radiating reflections, not speed-line clutter.",
    "genre": "quiet supernatural mystery manga"
  },
  "quality_profile": {
    "tier": "high",
    "goals": [
      "event clarity at thumbnail size",
      "expressive character acting",
      "dynamic event-driven composition",
      "strict reference continuity",
      "professional black-and-white manga finish"
    ],
    "variation_policy": "event_driven",
    "continuity_strictness": "locked",
    "detail_budget": "high",
    "self_check_required": true
  },
  "required_elements": [
    "Mira's crescent hair clip",
    "closed brass ticket punch in right hand",
    "ticket punch large enough to recognize",
    "rain streak reflections",
    "tense quiet expression"
  ],
  "prohibited_elements": [
    "dialogue_text",
    "captions",
    "speech_balloons",
    "sound_effect_text",
    "panel_borders",
    "page_numbers",
    "signatures",
    "watermarks",
    "color"
  ],
  "revision_history": [
    {
      "version": "v001",
      "output_filename": ".manga-studio/handoff/generated/panels/page-001-panel-03-v001.png",
      "supersedes_job_id": null,
      "supersedes_output_filename": null,
      "notes": "Initial page 001 panel 3 job."
    }
  ],
  "release_status": "deferred",
  "blocking_reasons": [
    "IMAGE_READY is false.",
    "Image generation is disabled for the pilot fixture."
  ],
  "deferred_reference_dependencies": [
    {
      "reference_id": "protagonist-mira-reference-v001",
      "source_job_id": "pilot-001-ref-protagonist-v001",
      "kind": "character_reference",
      "usage": "Use for Mira's face, hair, hair clip, wardrobe, and right hand."
    },
    {
      "reference_id": "brass-ticket-punch-reference-v001",
      "source_job_id": "pilot-001-ref-prop-v001",
      "kind": "prop_reference",
      "usage": "Use for exact shape, scale, and worn surface of the ticket punch."
    },
    {
      "reference_id": "rain-platform-reference-v001",
      "source_job_id": "pilot-001-ref-location-v001",
      "kind": "location_reference",
      "usage": "Use for background roof edge and rainy night texture."
    }
  ]
}
