{
  "schema_version": "1.3.0",
  "job_id": "pilot-001-panel-page-001-p2-v001",
  "job_type": "manga_panel",
  "output_filename": ".manga-studio/handoff/generated/panels/page-001-panel-02-v001.png",
  "output_spec": {"format": "png", "width": 1400, "height": 2200, "color_mode": "grayscale", "alpha_allowed": false},
  "content_constraints": {"age_band": "teen and older", "content_rating": "teen", "content_boundaries": ["No graphic injury", "No sexual content", "Threat remains suspenseful rather than sadistic"], "sensitivity_requirements": ["Fear responses should not be mocked", "Avoid glamorizing reckless isolation"], "accessibility_goals": ["Clear event order", "Readable concise dialogue", "Every SFX includes reader-facing meaning"]},
  "required_reference_images": [],
  "reference_priority": [
    "rain-platform-reference-v001",
    "supporting-ren-reference-v001"
  ],
  "scene_state": {
    "page_id": "page-001",
    "panel_id": "p2",
    "time": "night",
    "weather": "rain beyond the roof",
    "beat": "Ren looks down the empty platform and sees no train."
  },
  "character_state": {
    "ren": "Small figure on the platform, slightly turned toward the tracks.",
    "mira": "Off panel."
  },
  "composition": {
    "camera": "wide vertical platform view",
    "framing": "deep perspective down the empty platform with Ren near the lower right",
    "reading_focus": "empty platform depth, then Ren",
    "event_direction": {
      "event_type": "reveal",
      "intensity": 3,
      "importance": 3,
      "shot_size": "extreme_wide",
      "camera_angle": "birds_eye",
      "camera_motion": "pull_out",
      "action_direction": "away_from_camera",
      "emotional_beat": "the ordinary station becomes unnaturally empty",
      "pose_and_expression": "Ren is small in frame, cautious, and visibly searching the tracks",
      "show_dont_tell_cue": "Ren's reduced scale and searching posture let the impossible emptiness carry the reveal."
    },
    "background_priority": "story_critical"
  },
  "safe_zone_coordinate_system": "source_normalized",
  "dialogue_safe_zones": [
    {
      "x": 0.11,
      "y": 0.05,
      "width": 0.68,
      "height": 0.19
    }
  ],
  "manga_style": {
    "palette": "black-and-white",
    "linework": "clear architectural ink lines",
    "line_weight_strategy": "Heavy near architecture, medium figure contours, and fine receding perspective lines.",
    "solid_black_strategy": "Use solid black at the tunnel and roof recesses to frame the empty platform.",
    "screen_tones": "wet floor reflections and dark sky",
    "contrast_plan": "Ren remains readable against pale wet pavement while the tunnel anchors the darkest value.",
    "depth_plan": "Perspective convergence and progressively lighter tones establish long platform depth.",
    "motion_language": "Rain diagonals and converging architecture pull the eye away from the viewer.",
    "genre": "quiet supernatural mystery manga"
  },
  "quality_profile": {
    "tier": "high",
    "goals": [
      "event clarity at thumbnail size",
      "expressive character acting",
      "dynamic event-driven composition",
      "strict reference continuity",
      "professional black-and-white manga finish"
    ],
    "variation_policy": "event_driven",
    "continuity_strictness": "locked",
    "detail_budget": "high",
    "self_check_required": true
  },
  "required_elements": [
    "empty platform",
    "rain beyond the roof",
    "tracks visible",
    "Ren's round glasses readable",
    "no train visible"
  ],
  "prohibited_elements": [
    "dialogue_text",
    "captions",
    "speech_balloons",
    "sound_effect_text",
    "panel_borders",
    "page_numbers",
    "signatures",
    "watermarks",
    "color"
  ],
  "revision_history": [
    {
      "version": "v001",
      "output_filename": ".manga-studio/handoff/generated/panels/page-001-panel-02-v001.png",
      "supersedes_job_id": null,
      "supersedes_output_filename": null,
      "notes": "Initial page 001 panel 2 job."
    }
  ],
  "release_status": "deferred",
  "blocking_reasons": [
    "IMAGE_READY is false.",
    "Image generation is disabled for the pilot fixture."
  ],
  "deferred_reference_dependencies": [
    {
      "reference_id": "supporting-ren-reference-v001",
      "source_job_id": "pilot-001-ref-supporting-character-v001",
      "kind": "character_reference",
      "usage": "Use for Ren's profile, glasses, coat, and posture."
    },
    {
      "reference_id": "rain-platform-reference-v001",
      "source_job_id": "pilot-001-ref-location-v001",
      "kind": "location_reference",
      "usage": "Use for the empty platform, roof line, track edge, and rain placement."
    }
  ]
}
